[
  {
    "id": "grass",
    "name": "Grass",
    "desc": "Open ground. Everything walks, grows and builds here.",
    "visual": {
      "color": "#5b8a3c",
      "model": "hex_grass.glb",
      "shore": ["hex_coast_1.glb", "hex_coast_2.glb", "hex_coast_3.glb", "hex_coast_4.glb"]
    }
  },
  {
    "id": "water",
    "name": "Water",
    "desc": "The sea around the island. Nothing crosses it.",
    "passable": false,
    "visual": { "color": "#2f6f9f", "height": -0.1, "model": "hex_water.glb" }
  }
]
